{
  "ais1Version": "0.2",
  "agentClass": "soa",
  "agentDid": "did:ais1:base:claims-soa-001",
  "parentDid": "did:ais1:base:enterprise-ala-001",
  "sponsorDid": "did:ais1:sponsor:example-enterprise",
  "bond": {
    "bondId": "ais1:base:1002",
    "bondHash": "0xbbbbbbbbbbbbbbbbbbbbbbbbbbbbbbbbbbbbbbbbbbbbbbbbbbbbbbbbbbbbbbbb",
    "issuedAt": "2026-04-16T09:00:00Z",
    "issuedBy": "did:web:issuer.example.invalid",
    "tier": "verified",
    "jurisdiction": "IN",
    "expiry": null,
    "timestampServiceRef": "ots:bbbbbbbbbbbbbbbbbbbbbbbbbbbbbbbbbbbbbbbbbbbbbbbbbbbbbbbbbbbbbbbb"
  },
  "status": {
    "state": "active",
    "checkedAt": "2026-07-03T00:00:00Z",
    "registryRef": "https://ais-1.org/registry.json",
    "resolutionRef": "https://ais-1.org/resolve/claims-soa-001.json"
  },
  "soaParentCheck": {
    "parentActive": true,
    "parentStatusRef": "https://ais-1.org/resolve/enterprise-ala-001.json",
    "cascadeRevocationChecked": true
  },
  "assuranceContainer": {
    "uri": "https://example.invalid/ais1/claims-soa-001/assurance-container.json",
    "version": "1.1",
    "digest": "sha256:bbbbbbbbbbbbbbbbbbbbbbbbbbbbbbbbbbbbbbbbbbbbbbbbbbbbbbbbbbbbbbbb",
    "attestationTypes": [
      "aml-clearance"
    ]
  },
  "authorityBoundary": {
    "statement": "AIS-1 v0.2 SOA status establishes subordinate accountable identity under the parent ALA only.",
    "delegationRequired": true,
    "delegationPolicyUri": "https://example.invalid/policies/soa-delegation.json",
    "prohibitedInferences": [
      "Do not infer independent legal standing for an SOA.",
      "Do not rely on an SOA when the parent ALA is revoked.",
      "Do not infer action authority without separate delegation evidence."
    ]
  }
}
